{
  "authorizations": {
    "a0_sequence_build_authorized": false,
    "a1_sequence_build_authorized": false,
    "calibration_authorized": false,
    "dvc_commands_authorized": false,
    "e0_m_authorized": false,
    "e0_u_authorized": false,
    "effective_in_payload": false,
    "evaluation_authorized": false,
    "future_outcomes_accessed": false,
    "metrics_authorized": false,
    "outcome_access_authorized": false,
    "publication_required": true,
    "rollout_authorized": false,
    "scientific_network_authorized": false,
    "sequence_bundle_audit_authorized": false,
    "target_access_authorized": false,
    "temporal_fit_authorized": false
  },
  "created_at_utc": "2026-08-08T13:25:21.706053+00:00",
  "experiment_id": "closure_v1",
  "gate": "E0-MS",
  "h_patch": {
    "added_count": 10,
    "base_commit": "0a323b0b4c73384558b7782f63512b342a5411c5",
    "components": [
      {
        "bytes": 15575,
        "path": "configs/closure_v1/anfis_ablation_sequence_development_patch_lock.schema.json",
        "role": "anfis_ablation_sequence_development_patch_lock_schema",
        "sha256": "fe16ef9d7fa4cfeadd5054262520899eff37b7f4877896994b8c4056fb51db19"
      },
      {
        "bytes": 21827,
        "path": "configs/closure_v1/anfis_ablation_sequence_development_runtime.yaml",
        "role": "anfis_ablation_sequence_development_runtime",
        "sha256": "49d1a3f562f2cd68ff65f29c92ac4e028b3ad407f30a9960ea0d29260df7d56b"
      },
      {
        "bytes": 10436,
        "path": "docs/closure_v1/E0_M_ANFIS_ABLATION_SEQUENCE_DEVELOPMENT_PATCH_1.md",
        "role": "anfis_ablation_sequence_development_patch_protocol",
        "sha256": "4a07ab0c05561be1e5d46c31bddc9be4abb5b2ecdd0dd8eaab458b1e4b199bde"
      },
      {
        "bytes": 18190,
        "path": "src/experiments/audit_closure_anfis_ablation_sequence_bundle.py",
        "role": "anfis_ablation_sequence_bundle_auditor",
        "sha256": "60e3644f2993d9cfd763b1d9602e50959c4c8b01dc391156af6223c9846f9f22"
      },
      {
        "bytes": 63806,
        "path": "src/experiments/build_closure_anfis_ablation_sequences.py",
        "role": "anfis_ablation_sequence_builder",
        "sha256": "7fbf5dea26410ce8e1ea6b9e7f37f5fc5fb3e807476e605210d0dcf5c4ecd97a"
      },
      {
        "bytes": 108043,
        "path": "src/experiments/closure_anfis_ablation_sequence_development_patch.py",
        "role": "anfis_ablation_sequence_development_patch_validator",
        "sha256": "465f8c07fef0f09fc944aa5460381bb728be3f077e0679bbc7a8b47436342417"
      },
      {
        "bytes": 31428,
        "path": "src/experiments/lock_closure_anfis_ablation_sequence_development_patch.py",
        "role": "anfis_ablation_sequence_development_patch_locker",
        "sha256": "3b70757a8493b1f0daeca21cc45c3b5734b23758cfa3cbda0e7c7717157185aa"
      },
      {
        "bytes": 12614,
        "path": "tests/test_audit_closure_anfis_ablation_sequence_bundle.py",
        "role": "anfis_ablation_sequence_bundle_auditor_tests",
        "sha256": "59d2659d275a406ec8744086d94e4be5da7acebb7623be66f854dc67e580ee69"
      },
      {
        "bytes": 19702,
        "path": "tests/test_build_closure_anfis_ablation_sequences.py",
        "role": "anfis_ablation_sequence_builder_tests",
        "sha256": "7ed7f3595279ae6dc8ff87d4fec59ce52e9a960178f1f64c6205dfa3f0f86829"
      },
      {
        "bytes": 44716,
        "path": "tests/test_closure_anfis_ablation_sequence_development_patch.py",
        "role": "anfis_ablation_sequence_development_patch_tests",
        "sha256": "5bd9c6589aa6f2418d744f29c9b503efa38eb1082cb594d76a2785ea93210a4c"
      }
    ],
    "components_sha256": "5957487ae6368abade0bc5074f21e325df1a69dfa54e6bcc9370bebbfbb22229",
    "deleted_count": 0,
    "modified_count": 0,
    "paths": [
      "configs/closure_v1/anfis_ablation_sequence_development_patch_lock.schema.json",
      "configs/closure_v1/anfis_ablation_sequence_development_runtime.yaml",
      "docs/closure_v1/E0_M_ANFIS_ABLATION_SEQUENCE_DEVELOPMENT_PATCH_1.md",
      "src/experiments/audit_closure_anfis_ablation_sequence_bundle.py",
      "src/experiments/build_closure_anfis_ablation_sequences.py",
      "src/experiments/closure_anfis_ablation_sequence_development_patch.py",
      "src/experiments/lock_closure_anfis_ablation_sequence_development_patch.py",
      "tests/test_audit_closure_anfis_ablation_sequence_bundle.py",
      "tests/test_build_closure_anfis_ablation_sequences.py",
      "tests/test_closure_anfis_ablation_sequence_development_patch.py"
    ],
    "paths_sha256": "761bf3c5b66c9742fe269fd92146526cde7032b92a1645c2bce0dabc9bb18c32"
  },
  "lock_version": "closure_anfis_ablation_sequence_development_patch_lock_v1",
  "patch_id": "anfis_ablation_sequence_development_authority_patch_1",
  "prelock": {
    "control_namespace": {
      "p_guard_absent": true,
      "p_guard_path": "tmp/closure_v1_anfis_ablation_sequence_development_patch/lock_bundle.guard",
      "p_lock_absent": true,
      "p_lock_path": "reports/closure_v1/00_protocol/anfis_ablation_sequence_development_patch_lock.json",
      "p_lock_temporary_absent": true,
      "p_manifest_absent": true,
      "p_manifest_path": "reports/closure_v1/00_protocol/anfis_ablation_sequence_development_patch_lock_manifest.json",
      "p_manifest_temporary_absent": true
    },
    "dvc_commands_run": false,
    "e0_m_paths_present": 0,
    "future_outcomes_accessed": false,
    "m0_progression": {
      "manifest": {
        "bytes": 14446,
        "path": "reports/closure_v1/02_models/M0/manifest.json",
        "role": "m0_manifest",
        "sha256": "a4d005338c97e5bc7c869e255e1fd92406b583ca21e7e6929d9e584512c6d156"
      },
      "published_commit": "0a323b0b4c73384558b7782f63512b342a5411c5",
      "verified": true
    },
    "outcome_access_log_present": false,
    "output_namespace": {
      "absent_final_count": 18,
      "final_path_count": 18,
      "final_paths": [
        "data/closure_v1/development/sequences/A0/raw_no_current.parquet",
        "reports/closure_v1/01_surface/sequences/A0/raw_no_current_summary.csv",
        "reports/closure_v1/01_surface/sequences/A0/raw_no_current_manifest.json",
        "data/closure_v1/development/sequences/A1/seed_1729.parquet",
        "reports/closure_v1/01_surface/sequences/A1/seed_1729_summary.csv",
        "reports/closure_v1/01_surface/sequences/A1/seed_1729_manifest.json",
        "data/closure_v1/development/sequences/A1/seed_20260612.parquet",
        "reports/closure_v1/01_surface/sequences/A1/seed_20260612_summary.csv",
        "reports/closure_v1/01_surface/sequences/A1/seed_20260612_manifest.json",
        "data/closure_v1/development/sequences/A1/seed_20260613.parquet",
        "reports/closure_v1/01_surface/sequences/A1/seed_20260613_summary.csv",
        "reports/closure_v1/01_surface/sequences/A1/seed_20260613_manifest.json",
        "data/closure_v1/development/sequences/A1/seed_20260614.parquet",
        "reports/closure_v1/01_surface/sequences/A1/seed_20260614_summary.csv",
        "reports/closure_v1/01_surface/sequences/A1/seed_20260614_manifest.json",
        "data/closure_v1/development/sequences/A1/seed_314159.parquet",
        "reports/closure_v1/01_surface/sequences/A1/seed_314159_summary.csv",
        "reports/closure_v1/01_surface/sequences/A1/seed_314159_manifest.json"
      ],
      "final_paths_sha256": "3e4b8e2d07ec97de2644d927f4a88964daed1249f2ed23e6db7e33b0d3c004fc",
      "guard_path_count": 6,
      "guard_paths": [
        "tmp/closure_v1_anfis_ablation_sequences/A0_raw_no_current.guard",
        "tmp/closure_v1_anfis_ablation_sequences/A1_seed_1729.guard",
        "tmp/closure_v1_anfis_ablation_sequences/A1_seed_20260612.guard",
        "tmp/closure_v1_anfis_ablation_sequences/A1_seed_20260613.guard",
        "tmp/closure_v1_anfis_ablation_sequences/A1_seed_20260614.guard",
        "tmp/closure_v1_anfis_ablation_sequences/A1_seed_314159.guard"
      ],
      "guard_paths_sha256": "f39527de823b3d15764816d2ffecb05258ae747957382946345fe96ff9bcdbec",
      "pointer_path_count": 6,
      "pointer_paths": [
        "data/closure_v1/development/sequences/A0/raw_no_current.parquet.dvc",
        "data/closure_v1/development/sequences/A1/seed_1729.parquet.dvc",
        "data/closure_v1/development/sequences/A1/seed_20260612.parquet.dvc",
        "data/closure_v1/development/sequences/A1/seed_20260613.parquet.dvc",
        "data/closure_v1/development/sequences/A1/seed_20260614.parquet.dvc",
        "data/closure_v1/development/sequences/A1/seed_314159.parquet.dvc"
      ],
      "pointer_paths_sha256": "795937551edd0bff6454cd62f285595bedbbbdf349583d482838fc608ff90e10",
      "pointer_temporary_path_count": 6,
      "pointer_temporary_paths": [
        "data/closure_v1/development/sequences/A0/raw_no_current.parquet.dvc.tmp",
        "data/closure_v1/development/sequences/A1/seed_1729.parquet.dvc.tmp",
        "data/closure_v1/development/sequences/A1/seed_20260612.parquet.dvc.tmp",
        "data/closure_v1/development/sequences/A1/seed_20260613.parquet.dvc.tmp",
        "data/closure_v1/development/sequences/A1/seed_20260614.parquet.dvc.tmp",
        "data/closure_v1/development/sequences/A1/seed_314159.parquet.dvc.tmp"
      ],
      "pointer_temporary_paths_sha256": "792e56afed27a6c5b8c69de056e0a264468badbca756d6cfb6bf9eeb83ab0cc9",
      "present_final_count": 0,
      "present_guard_count": 0,
      "present_pointer_count": 0,
      "present_pointer_temporary_count": 0,
      "present_temporary_count": 0,
      "temporary_path_count": 18,
      "temporary_paths": [
        "data/closure_v1/development/sequences/A0/raw_no_current.parquet.tmp",
        "reports/closure_v1/01_surface/sequences/A0/raw_no_current_summary.csv.tmp",
        "reports/closure_v1/01_surface/sequences/A0/raw_no_current_manifest.json.tmp",
        "data/closure_v1/development/sequences/A1/seed_1729.parquet.tmp",